{
  "acquisition": {
    "authority_basis": "synthetic_project_owned: generated locally by the AV-TRACE project",
    "authority_evidence_hash": "sha256:4da8424a92871c1491d06416460ab0191e01e4d23c23a62a98ec31a402037a43",
    "authority_evidence_uri": "https://example.invalid/av-trace-synthetic/rights",
    "method": "rightsholder_delivery",
    "planned_or_actual_at": "2026-09-05T00:00:00Z",
    "status": "completed"
  },
  "asset_id": "syn_source_03",
  "audit": {
    "change_log": [
      {
        "changed_at": "2026-09-05T00:00:00Z",
        "changed_by": "synthetic_generator",
        "summary": "Generated deterministic synthetic_project_owned corpus asset."
      }
    ],
    "created_by": "synthetic_generator",
    "gate_status": "public_release_approved",
    "record_created_at": "2026-09-05T00:00:00Z",
    "record_updated_at": "2026-09-05T00:00:00Z",
    "updated_by": "synthetic_generator"
  },
  "dataset_id": "synthetic_project_owned",
  "derived_artifacts": [
    {
      "artifact_id": "timeline_syn_source_03",
      "artifact_type": "annotation",
      "contains_personal_data": false,
      "created_at": "2026-09-05T00:00:00Z",
      "evidence_snapshot_hash": "sha256:4da8424a92871c1491d06416460ab0191e01e4d23c23a62a98ec31a402037a43",
      "release_audience": "public",
      "release_decision": "allowed",
      "rights_basis": {
        "license_or_grant_name": "synthetic_project_owned",
        "licensor_or_grantor": "AV-TRACE project",
        "scope": "Project-owned procedural media and all generated metadata.",
        "uri": "https://example.invalid/av-trace-synthetic/rights",
        "version": "1"
      },
      "sha256": "sha256:a2802f14099b3495ab8403501e221f2cbd5e428b4c3c5639fe3be0a27bd1b6fe",
      "source_asset_id": "syn_source_03",
      "substitution_risk_reviewed": true,
      "tool_or_protocol": "av_trace_mvp.synthetic_data/1.0.0",
      "uri": "https://example.invalid/av-trace-synthetic/timelines/syn_source_03.json"
    },
    {
      "artifact_id": "transcript_syn_source_03",
      "artifact_type": "transcript",
      "contains_personal_data": false,
      "created_at": "2026-09-05T00:00:00Z",
      "evidence_snapshot_hash": "sha256:4da8424a92871c1491d06416460ab0191e01e4d23c23a62a98ec31a402037a43",
      "release_audience": "public",
      "release_decision": "allowed",
      "rights_basis": {
        "license_or_grant_name": "synthetic_project_owned",
        "licensor_or_grantor": "AV-TRACE project",
        "scope": "Project-owned procedural media and all generated metadata.",
        "uri": "https://example.invalid/av-trace-synthetic/rights",
        "version": "1"
      },
      "sha256": "sha256:5a83ab52ab3698367934da4458997a1ebc6f186d67ed1d305b51aaa0dcdc3d51",
      "source_asset_id": "syn_source_03",
      "substitution_risk_reviewed": true,
      "tool_or_protocol": "av_trace_mvp.synthetic_data/1.0.0",
      "uri": "https://example.invalid/av-trace-synthetic/transcripts/syn_source_03.json"
    },
    {
      "artifact_id": "audio_events_syn_source_03",
      "artifact_type": "annotation",
      "contains_personal_data": false,
      "created_at": "2026-09-05T00:00:00Z",
      "evidence_snapshot_hash": "sha256:4da8424a92871c1491d06416460ab0191e01e4d23c23a62a98ec31a402037a43",
      "release_audience": "public",
      "release_decision": "allowed",
      "rights_basis": {
        "license_or_grant_name": "synthetic_project_owned",
        "licensor_or_grantor": "AV-TRACE project",
        "scope": "Project-owned procedural media and all generated metadata.",
        "uri": "https://example.invalid/av-trace-synthetic/rights",
        "version": "1"
      },
      "sha256": "sha256:1b3c4d7ffaa4a8f2af9a1b4199f36a9a0d5afed4d31bfdf379f94cf1dade6914",
      "source_asset_id": "syn_source_03",
      "substitution_risk_reviewed": true,
      "tool_or_protocol": "av_trace_mvp.synthetic_data/1.0.0",
      "uri": "https://example.invalid/av-trace-synthetic/audio_events/syn_source_03.json"
    },
    {
      "artifact_id": "evidence_syn_source_03",
      "artifact_type": "annotation",
      "contains_personal_data": false,
      "created_at": "2026-09-05T00:00:00Z",
      "evidence_snapshot_hash": "sha256:4da8424a92871c1491d06416460ab0191e01e4d23c23a62a98ec31a402037a43",
      "release_audience": "public",
      "release_decision": "allowed",
      "rights_basis": {
        "license_or_grant_name": "synthetic_project_owned",
        "licensor_or_grantor": "AV-TRACE project",
        "scope": "Project-owned procedural media and all generated metadata.",
        "uri": "https://example.invalid/av-trace-synthetic/rights",
        "version": "1"
      },
      "sha256": "sha256:4d676c1dad7c612d63a688ffaa3e34c342a76043ef27d9a9fdbdf9229241ee47",
      "source_asset_id": "syn_source_03",
      "substitution_risk_reviewed": true,
      "tool_or_protocol": "av_trace_mvp.synthetic_data/1.0.0",
      "uri": "https://example.invalid/av-trace-synthetic/evidence/syn_source_03.json"
    }
  ],
  "integrity": {
    "byte_size": 1377695,
    "content_hash_plan": "sha256_of_exact_acquired_bytes",
    "content_sha256": "sha256:36b74655786d7c6ffc22086d566d30dd7c2396bf1cd54228af240aa3d21b310f",
    "probe_version": "PyAV-16.1.0"
  },
  "manifest_revision": "synthetic-v1",
  "manifest_version": "0.2.0",
  "media": {
    "duration_s": 360.0,
    "embedded_content_reviewed": true,
    "has_ambient_audio": true,
    "has_audio": true,
    "has_speech": true,
    "has_video": true
  },
  "privacy_safety": {
    "contains_identifiable_people": false,
    "contains_minors": false,
    "contains_sensitive_content": false,
    "mitigations": [
      "Procedural shapes, labels, tones, and noise only."
    ],
    "review_status": "approved",
    "reviewed_at": "2026-09-05T00:00:00Z",
    "reviewer_id": "synthetic_privacy_reviewer"
  },
  "rights": {
    "acquisition_authority": "allowed",
    "copyright_basis": "direct_permission",
    "decisions": {
      "acquisition": "allowed",
      "annotation_release": "allowed",
      "commercial_use": "allowed",
      "derivative_release": "allowed",
      "processing": "allowed",
      "raw_media_release": "allowed",
      "transcript_release": "allowed"
    },
    "embedded_components": {
      "identifiable_people": "not_applicable",
      "logos_and_marks": "not_applicable",
      "minors": "not_applicable",
      "music": "not_applicable",
      "subtitles": "not_applicable",
      "third_party_inserts": "not_applicable"
    },
    "evidence_snapshot": {
      "captured_at": "2026-09-05T00:00:00Z",
      "sha256": "sha256:4da8424a92871c1491d06416460ab0191e01e4d23c23a62a98ec31a402037a43",
      "uri": "https://example.invalid/av-trace-synthetic/rights-snapshot"
    },
    "license_or_grant": {
      "agreement_id": "project-owned-syn_source_03",
      "licensor_or_grantor": "AV-TRACE project",
      "name": "synthetic_project_owned",
      "scope": "Unrestricted project use and release of procedurally generated media and metadata.",
      "uri": "https://example.invalid/av-trace-synthetic/rights",
      "version": "1"
    },
    "local_processing_authority": "allowed",
    "review": {
      "jurisdiction": "project-owned synthetic fixture",
      "notes": "No downloaded, third-party, copyrighted, or real-world media are present.",
      "outcome": "approved",
      "reviewed_at": "2026-09-05T00:00:00Z",
      "reviewer_id": "synthetic_rights_reviewer"
    },
    "rights_decision_id": "rights_syn_source_03"
  },
  "source": {
    "canonical_url": "https://example.invalid/av-trace-synthetic/syn_source_03",
    "publisher": "AV-TRACE project",
    "rightsholder_or_status": "synthetic_project_owned",
    "source_family": "DIRECT_GRANT",
    "source_identifier": "syn_source_03",
    "source_revision": "procedural-v1"
  }
}
